,,,Output (Tunisian),Output (Tunisian),Output (Tunisian),Total Reward,Total Reward,Total Reward
Model Stage,,,DPO Dialect,GRPO Final,Initial SFT,DPO Dialect,GRPO Final,Initial SFT
Example #,Input (English),Ref (Tunisian),,,,,,
1,How do you say 'north-east' in Tunisian?,كيفاش تقول 'شمال شرقي' بالتونسي؟,ترجم لهنا بالعربي التونسي كيفاش تقول 'شمال الشرقي' بالتونسي؟,ترجم لعبسي تونسي كيفاش تقول 'شمال الشرقي' بالتونسي؟,ترجم لهنا بالعربي التونسي كيفاش تقول 'شمال الشرقي' بالتونسي؟,2.48,2.98,2.48
2,Can you give me the 'to weaken'?,تنجم تعطيني 'رد ضعيف'؟,ترجم لهنا بالعربي التونسي: تنجم تعطيني 'ضعف'؟,ترجم لعبسي تونسي: تنجم تعطيني 'ضعف'؟,ترجم لهنا بالعربي التونسي: تنجم تعطيني 'ضعف'؟,2.04,2.62,2.04
3,What is the word for 'a show' ?,شنوة كلمة 'شو'؟,ترجم لهنا بالعربي التونسي شنوة كلمة 'شو'؟,ترجم لهنا لغارا تونسي: شنوة كلمة 'شو'؟,ترجم لهنا بالعربي التونسي شنوة كلمة 'شو'؟,3.08,3.29,3.08
4,"What does 'verb, action ' mean?",شنوة معناها 'فعل'؟,ترجم لهنا بالعربي التونسي: شنوة معناها 'فعل'؟,ترجم لهنا لغارا تونسي: شنوة معناها 'فعل'؟,ترجم لهنا بالعربي التونسي: شنوة معناها 'فعل'؟,2.57,2.81,2.57
5,The purpose of stealing someone else's place is to steal the place of another.,فك البقعه,ترجم لهنا بالعربيه التونسييه: الغرض من سرقه مكان الاخر هو سرقه محل الاخر.,ترجم لهنا لغارا تونسي: الغرض من سرق مكان الاخر هو سرق مكان الاخر.,ترجم لهنا بالعربيه التونسييه: الغرض من سرق مكان الاخر هو سرق مكان الاخر.,0.61,0.92,0.64
6,Where is the 'scotch tape'?,وين 'سكوتش'؟,ترجم لهنا بالعربي التونسي: وين 'سكوتش'؟,ترجم لهنا لغارا تونسي: وين 'سكوتش'؟,ترجم لهنا بالعربي التونسي: وين 'سكوتش'؟,2.93,3.23,2.93
7,'ray','ريون',ترجم لهنا بالعربي التونسي 'شعاع',ترجم لهنا لغارا تونسي 'شعاع',ترجم لهنا بالعربي التونسي 'شعاع',0.26,0.24,0.26
8,None,,ترجم لهنا بالعربيه التونسي,ترجم لهنا لغارا تونسي,ترجم هذا لغات عربيه تونسيه,0.0,0.0,0.0
9,"In Derja , write 'turmeric' .",اكتب 'كركم' بالدارجة.,ترجم لهنا بالعربي التونسي: بالدارجة اكتب 'قرقه'.,ترجم لهنا لغارا تونسي: بالدارجة اكتب 'كركم'.,ترجم لهنا بالعربي التونسي: بالدارجة اكتب 'قرقه'.,1.38,1.59,1.38
10,Write in Derja 's name ' ; cane ' ;,اكتب 'قصب' بالدارجة.,ترجم لهنا بالعربي التونسي اكتب بالدارجة ' ؛ عصا ' ؛,ترجم لهنا لغارا تونسي اكتب بالدارجة ' ؛ عصا ' ؛,ترجم لهنا بالعربي التونسي اكتب بالدارجة ' ؛ عصا ' ؛,1.2,1.44,1.2
11,To take a risk:,جازف,ترجم لهنا بالعربيه التونسي,ترجم لهنا لغارا تونسي,ترجم لهنا بالعربيه التونسي,0.53,1.06,0.53
12,Seek hide and seek,غميضه,ترجم لهنا بالعربي التونسي,ترجم لعبسي تونسي,ترجم لهنا بالعربي التونسي,0.79,1.69,0.79
13,"Can you give me the 'calmness, quiet'?",تنجم تعطيني 'هدوء'؟,ترجم لهنا بالعربي التونسي: تنجم تعطيني 'هدوء'؟,ترجم لعبسي تونسي: تنجم تعطيني 'هدوء'؟,ترجم لهنا بالعربي التونسي: تنجم تعطيني 'هدوء'؟,3.43,3.94,3.43
14,Translate 'renew' please.,ترجم 'جدد' بربي.,ترجم لهنا بالعربي التونسي: ترجم 'تجديد' بربي.,ترجم لهنا لغارا تونسي: ترجم 'تجديد' بربي.,ترجم لهنا بالعربي التونسي: ترجم 'تجديد' بربي.,1.86,1.97,1.86
15,Translate 'census' please .,ترجم 'احصاء' بربي.,ترجم لهنا بالعربي التونسي: ترجم 'احصاء' بربي.,ترجم لهنا بالعربي التونسي: ترجم 'احصاء' بربي.,ترجم لهنا بالعربي التونسي: ترجم 'احصاء' بربي.,2.87,2.87,2.87
16,Where is the 'idol worship'?,وين 'عباده الاصنام'؟,ترجم لهنا بالعربي التونسي: وين 'عباده الاصنام'؟,ترجم لهنا لغارا تونسي: وين 'عباده الصنابل'؟,ترجم لهنا بالعربي التونسي: وين 'عباده الاصنام'؟,2.6,1.9,2.6
17,What does the 'accounting department' mean?,شنوة معناها 'دائره المحاسبات'؟,ترجم لهنا بالعربي التونسي: شنوة معناها 'محاسبه'؟,ترجم لهنا لغارا تونسي: شنوة معناها 'قسم المحاسبات'؟,ترجم لهنا بالعربي التونسي: شنوة معناها 'قسم المحاسبات'؟,1.51,2.12,2.09
18,None,,ترجم لهنا بالعربيه التونسي,ترجم لهنا لغارا تونسي,ترجم هذا لغات عربيه تونسيه,0.0,0.0,0.0
19,"Do you have 'view, panorama'?",عندك 'منظر'؟,ترجم لهنا بالعربي التونسي: عندك 'منظر'؟,ترجم لعبسي تونسي: عندك 'منظر'؟,ترجم لهنا بالعربي التونسي: عندك 'منظر'؟,3.13,3.77,3.13
20,"What does 'excellent, superb' mean?",شنوة معناها 'ممتاز'؟,ترجم لهنا بالعربي التونسي: شنوة معناها 'ممتاز'؟,ترجم لهنا لغارا تونسي: شنوة معناها 'ممتاز'؟,ترجم لهنا بالعربي التونسي: شنوة معناها 'ممتاز'؟,3.32,3.55,3.32
